{
  "evidence_id":"EV-003","evidence_type":"provider_export","title":"Redacted configuration export","producer":"Synthetic Customer Cloud Team","source_ref":"secure://config-export-001","locator":"resources 12-22","claim_ids":["CL-DATA-01","CL-KEY-01"],"gate_ids":["HG-02","HG-03","HG-06","HG-08"],"scope":{"workload_id":"WL-001","service":"Service-X","location":"EU"},"valid_at":"2026-09-03T08:00:00Z","version":"snapshot-1","applied_state":"configured","base_trust":3,"scope_fit":5,"freshness_fit":5,"sensitivity":"confidential","review_status":"normalized","notes":"Provider-neutral fixture; no real resource identifiers."
}
