{
  "evidence_id": "EV-001",
  "evidence_type": "contractual",
  "title": "Contract and DPA summary",
  "producer": "Synthetic Customer Legal",
  "source_ref": "secure://contract-001",
  "locator": "sections 2, 7, 12",
  "claim_ids": ["CL-LJ-01"],
  "gate_ids": ["HG-01"],
  "request_ids": ["ER-001", "ER-002"],
  "scope": {"workload_id": "WL-001", "service": "Service-X", "contract": "CON-001"},
  "valid_at": "2026-09-01T00:00:00Z",
  "version": "1.0",
  "applied_state": "documented",
  "base_trust": 4,
  "scope_fit": 4,
  "freshness_fit": 5,
  "sensitivity": "confidential",
  "review_status": "reviewed",
  "notes": "Synthetic contract locator only. Explicit request mapping is internal pilot metadata and does not prove legal sufficiency by itself."
}
